TopicWords,Scores
ensino  bolsa  prouni  bolsas  beneficiários  médio  modalidade  instituição  programa  perfil,"['0.011', '0.011', '0.011', '0.011', '0.011', '0.011', '0.011', '0.011', '0.011', '0.011']"
ensino  prouni  bolsas  bolsa  superior  perfil  beneficiários  programa  instituições  rede,"['0.011', '0.011', '0.011', '0.011', '0.011', '0.011', '0.011', '0.011', '0.011', '0.011']"
ensino  bolsa  prouni  bolsas  beneficiários  presencial  programa  médio  detalhamento  rede,"['0.011', '0.011', '0.011', '0.011', '0.011', '0.011', '0.011', '0.011', '0.011', '0.011']"
bolsa  ensino  nome  presencial  modalidade  instituição  prouni  faixa  sexo  parcial,"['0.097', '0.066', '0.063', '0.037', '0.037', '0.037', '0.036', '0.033', '0.033', '0.033']"
ensino  bolsa  prouni  bolsas  médio  beneficiários  perfil  programa  nome  instituição,"['0.011', '0.011', '0.011', '0.011', '0.011', '0.011', '0.011', '0.011', '0.011', '0.011']"
bolsas  perfil  ensino  beneficiários  prouni  concedidas  desempenhos  conjugando  desse  enem,"['0.038', '0.038', '0.036', '0.035', '0.035', '0.033', '0.027', '0.026', '0.026', '0.026']"
prouni  detalhamento  selecionados  salários  máxima  mínimos  obtidas  informatizado  processo  seleção,"['0.043', '0.024', '0.024', '0.024', '0.024', '0.024', '0.024', '0.024', '0.024', '0.024']"
integrais  ensino  instituições  rede  programa  prouni  estudantes  concessão  pública  condição,"['0.041', '0.041', '0.041', '0.041', '0.041', '0.022', '0.022', '0.022', '0.022', '0.022']"
